{
  "deployId": "dep-daavildbedkc73et8b40",
  "environment": "production",
  "service": {
    "id": "srv-daarb8rtqb8s73dvucm0",
    "name": "studio-810",
    "publicUrl": "https://wearestudio810.onrender.com"
  },
  "expectedSha": "f1be14568716ca9f7695b327a836da198150e929",
  "deploy": {
    "status": "live",
    "servingSha": "f1be14568716ca9f7695b327a836da198150e929",
    "finishedAt": "2026-08-31T21:59:57.958843Z"
  },
  "health": {
    "httpStatus": 200,
    "tlsValid": true,
    "certificateSubject": "CN=onrender.com",
    "checkedUrl": "https://wearestudio810.onrender.com",
    "contentMarker": "<title>Studio 810</title>"
  },
  "customDomains": [],
  "infraDrift": [
    {
      "setting": "name",
      "declared": "wearestudio810",
      "actual": "studio-810",
      "authority": "repo"
    },
    {
      "setting": "prPreviewsEnabled",
      "declared": "automatic (enabled in dashboard 2026-08-31 per docs/sources-of-truth.md)",
      "actual": "off",
      "authority": "repo"
    }
  ],
  "outcome": "degraded"
}
