{
  "deployId": "dep-dab071jbc2fs73aon7f0",
  "environment": "production",
  "service": {
    "id": "srv-daarb8rtqb8s73dvucm0",
    "name": "studio-810",
    "publicUrl": "https://wearestudio810.onrender.com"
  },
  "expectedSha": "37c80e04501e16eb2fc998b2264a8e63d4f01a93",
  "deploy": {
    "status": "live",
    "servingSha": "37c80e04501e16eb2fc998b2264a8e63d4f01a93",
    "finishedAt": "2026-08-31T22:43:26.126924Z"
  },
  "health": {
    "httpStatus": 200,
    "tlsValid": true,
    "certificateSubject": "CN=onrender.com",
    "checkedUrl": "https://wearestudio810.onrender.com",
    "contentMarker": "<title>Studio 810</title>"
  },
  "customDomains": [],
  "infraDrift": [],
  "outcome": "live"
}
